{
  "schemaVersion": "1.0",
  "id": "6a7addc900000000280064dd",
  "capturedAt": "2026-08-16T11:07:43.356Z",
  "strategy": "structured_state",
  "artifactRef": null,
  "error": null,
  "fields": {
    "title": "开源一个插件，帮你从YouTube长视频中学习",
    "postCopy": "YouTube Digest，支持获取视频的中英双语逐字稿、解释术语、笔记等等功能",
    "hashtags": [],
    "sourceUrl": "https://www.xiaohongshu.com/explore/6a7addc900000000280064dd",
    "mediaType": "video",
    "publishedAt": "2026-08-11T08:31:05.000Z",
    "likes": "2543",
    "collections": "2527",
    "comments": "103",
    "shares": "498",
    "expectedDurationSec": 438
  },
  "subtitleStatus": "unchecked",
  "mediaCandidates": [
    {
      "kind": "video",
      "availability": "available",
      "expectedDurationSec": 438
    }
  ]
}
