{
  "schemaVersion": "1.0",
  "id": "6a47083200000000210236a2",
  "capturedAt": "2026-08-16T11:09:02.760Z",
  "strategy": "structured_state",
  "artifactRef": null,
  "error": null,
  "fields": {
    "title": "为什么我做内容特别快？因为功夫在诗外",
    "postCopy": "内核 > 外表\n\t\n#内容创作[话题]#",
    "hashtags": [
      "内容创作"
    ],
    "sourceUrl": "https://www.xiaohongshu.com/explore/6a47083200000000210236a2",
    "mediaType": "video",
    "publishedAt": "2026-07-03T00:54:10.000Z",
    "likes": "2644",
    "collections": "1003",
    "comments": "97",
    "shares": "290",
    "expectedDurationSec": 190
  },
  "subtitleStatus": "unchecked",
  "mediaCandidates": [
    {
      "kind": "video",
      "availability": "available",
      "expectedDurationSec": 190
    }
  ]
}
