{
  "schemaVersion": "1.0",
  "id": "6a31edc300000000200387f4",
  "capturedAt": "2026-08-16T11:29:34.041Z",
  "strategy": "structured_state",
  "artifactRef": null,
  "error": null,
  "fields": {
    "title": "如何一年在Twitter涨粉7万：我做内容的方法",
    "postCopy": "分享我做X的方法。（这个视频的动画和剪辑都会Claude Code做的）\n\t\n#Twitter[话题]# #内容创作[话题]#",
    "hashtags": [
      "Twitter",
      "内容创作"
    ],
    "topComments": [
      {
        "content": "昨天读了李诞的自媒体工作手册，也说到一个类似的观点。如果在我们在内容创作的时候，总是想着粉丝是否关注我，内容是否爆，这个数据怎么样，那这个创作分享的过程就变成是一个工作，是一个，痛苦的工作，很快就失去了创作跟分享的热情。博主说到的这个要怀着对别人有用，跟用户一起成长，这是一个 party，一起去讨论，一起去分享，一起去收获的这种想法的。我觉得是跟前面读到的这本书的内容是有异曲同工之妙的。\nBy the way, 昨天在飞书的直播看到你。",
        "likes": "297",
        "ipLocation": "广东",
        "author": "AI优先的耀棠",
        "replies": [
          {
            "content": "@野生Anita",
            "author": "爱打网球的小玉酱"
          }
        ]
      },
      {
        "content": "你的帖子我不喜欢。但是你的观点我认可",
        "likes": "0",
        "ipLocation": "北京",
        "author": "momo",
        "replies": [
          {
            "content": "这句话该怎么理解呢",
            "author": "露米森森"
          }
        ]
      },
      {
        "content": "我真的很喜欢你这样优秀的姐姐，我现在要边看边同时做笔记[哇R]刚看完开头我就知道，嗯。一定会很干货！一定能对我的O PC事业和我的海外媒体运营有帮助！",
        "likes": "3",
        "ipLocation": "四川",
        "author": "上进百香果",
        "replies": [
          {
            "content": "第一，把Twitter理解成party，而不是一个演讲者模式哇，太棒了这个思路",
            "author": "上进百香果"
          }
        ]
      },
      {
        "content": "感觉 人的高质量的输出变得更加重要了！",
        "likes": "75",
        "ipLocation": "北京",
        "author": "爱穿6cm鲸鱼cross的中年男人",
        "replies": [
          {
            "content": "当 AI 输出越来越完美，人的瑕疵也变得弥足珍贵",
            "author": "再创业是小狗"
          }
        ]
      },
      {
        "content": "老师，下面的这个是怎么做的？",
        "likes": "6",
        "ipLocation": "广东",
        "author": "Sucarrie",
        "replies": [
          {
            "content": "Claude Code做的HTML",
            "author": "张咋啦"
          }
        ]
      },
      {
        "content": "请问 zara 姐，是飞书组织进化论之前的主持人 zara 吗 之前很喜欢那档播客[害羞R]",
        "likes": "3",
        "ipLocation": "福建",
        "author": "路博丨超级路播",
        "replies": [
          {
            "content": "找到啦！[害羞R]粉上加粉了",
            "author": "路博丨超级路播"
          }
        ]
      },
      {
        "content": "最近一点小感悟：Ai是工具，你本身要懂业务的底层逻辑，清晰工作流，能精准提问，这样命令才能有效部署下去。另外就是判断力，知道哪些该交给Ai，哪些事情即便很累，但人去做才更有价值",
        "likes": "28",
        "ipLocation": "浙江",
        "author": "一包浪味仙",
        "replies": [
          {
            "content": "留",
            "author": "奥利奥🍪"
          }
        ]
      },
      {
        "content": "@问一问 帮我梳理视频内容",
        "likes": "0",
        "ipLocation": "四川",
        "author": "志明Raphael",
        "replies": [
          {
            "content": "这条内容的核心是： 做内容不是上台演讲，而是参加派对 。先找到圈子、听别人聊什么，再自然加入对话，靠真诚互动和持续提供价值来建立影响力，而不是靠AI量产内容或投机技巧。\n核心心智：把平台当成“派对”场景，先观察、再参与，重点是建立真实连接\n前期重点：不追求一上来就完美表达，而是先做真实、有判断力、能持续输出的人\n四个有效动作：\n调教算法：刷到不感兴趣的内容点“不感兴趣”，刷到高质量内容就点赞、转发、评论或收藏，让信息流慢慢变成你想参与的圈子\n真诚回复：不要用AI批量回复；在别人帖子下提供真正有信息量、有观点的评论，才可能被原作者注意到，进而带来互动和曝光\n高频发帖：把发帖变成日常习惯，而不是专门抽时间完成的任务\n前期少依赖AI写作：在自己没有形成内容判断力和写作风格前，真实、粗糙但有个人思考，通常比精致但空洞更有效\n三个可执行习惯：\nLearn in public：学到新东西就公开分享，并@原作者\nGive feedback in public：体验新产品后，公开写推荐或反馈，并@官方账号和创始人\nBuild in public：公开分享自己做的产品demo、录屏、动图等内容，哪怕粗糙也没关系\n评论区高频共识是：真诚、真实、利他，比技巧更重要；人的判断力、审美和真实表达，在AI内容越来越多时反而更稀缺、更有价值。",
            "author": "问一问"
          }
        ]
      },
      {
        "content": "@问一问 总结一下",
        "likes": "0",
        "ipLocation": "四川",
        "author": "数字花园Info",
        "replies": [
          {
            "content": "这条内容的核心是： 做内容不是上台演讲，而是参加派对 。先找到圈子、听别人聊什么，再自然加入对话，靠真诚互动和持续提供价值来建立影响力，而不是靠AI量产内容或投机技巧。\n核心心智：把平台当成“派对”场景，先观察、再参与，重点是建立真实连接\n前期重点：不追求一上来就完美表达，而是先做真实、有判断力、能持续输出的人\n四个有效动作\n调教算法：刷到不感兴趣的内容点“不感兴趣”，刷到高质量内容就点赞、转发、评论或收藏，让信息流慢慢变成你想参与的圈子\n真诚回复：不要用AI批量回复；在别人帖子下提供真正有信息量、有观点的评论，才可能被原作者注意到，进而带来互动和曝光\n高频发帖：把发帖变成日常习惯，而不是专门抽时间完成的任务\n前期少依赖AI写作：在自己没有形成内容判断力和写作风格前，真实、粗糙但有个人思考，通常比精致但空洞更有效\n三个可执行习惯\nLearn in public：学到新东西就公开分享，并@原作者\nGive feedback in public：体验新产品后，公开写推荐或反馈，并@官方账号和创始人\nBuild in public：公开分享自己做的产品demo、录屏、动图等内容，哪怕粗糙也没关系\n评论区高频共识是：真诚、真实、利他，比技巧更重要；人的判断力、审美和真实表达，在AI内容越来越多时反而更稀缺、更有价值。",
            "author": "问一问"
          }
        ]
      },
      {
        "content": "谢谢 Zara 的分享，之前一直以为，社交媒体是需要秀出你比别人做得更好的那一面。但是互联网上有这么多做得很棒的人，经常会觉得自己不如别人，所以会想：我是不是还没有资格，或者还不应该把这些东西分享出来？我已经有的东西是不是不够成熟？但打动我的其实是那个 party 的想法。原来我跟他们不只是向他们学习，或者去跟这些已经存在的大 V 比较谁更厉害、我有什么比他强的地方才能出来分享。这是一个 party，我是可以加入进去的。\n以这样的心态，就可以非常简单地开始了。",
        "likes": "3",
        "ipLocation": "北京",
        "author": "like不赖",
        "replies": [
          {
            "content": "忘记是谁说的了，前三十万字的垃圾就是为了后面高质量的二十万字做准备的。",
            "author": "露米森森"
          }
        ]
      }
    ],
    "sourceUrl": "https://www.xiaohongshu.com/explore/6a31edc300000000200387f4",
    "mediaType": "video",
    "publishedAt": "2026-06-17T00:43:47.000Z",
    "likes": "9444",
    "collections": "8237",
    "comments": "273",
    "shares": "1545",
    "expectedDurationSec": 381
  },
  "subtitleStatus": "unchecked",
  "mediaCandidates": [
    {
      "kind": "video",
      "availability": "available",
      "expectedDurationSec": 381
    }
  ]
}
