{
  "schemaVersion": "1.0",
  "id": "69efb709000000003703436a",
  "capturedAt": "2026-08-16T11:09:57.527Z",
  "strategy": "structured_state",
  "artifactRef": null,
  "error": null,
  "fields": {
    "title": "全程回放（2）Demo Day：我如何与agent协作",
    "postCopy": "线上活动的回放，总共分成3个部分，这是Part 2。\n\t\n1. Aria @11爱吃饭 （Google，agent产品工程师）：如何让agent更了解你，成为你的外置大脑\n2. Cindy (Human builder at Slock): 8 humans x 66 agents 的团队进化史\n3. 子琦(右弦科技CEO): 如何给Claude code配一个OpenClaw 当小弟\n4. Daniel (OPC+独立开发者): 飞书里的 Agentic Workspace：我如何和 Agents 团队一起工作\n5. 刘明远 (北京星烨垚垚科技有限公司高级研究工程师): 效率加倍，我的多Agent工作实操分享",
    "hashtags": [],
    "sourceUrl": "https://www.xiaohongshu.com/explore/69efb709000000003703436a",
    "mediaType": "video",
    "publishedAt": "2026-04-27T19:20:41.000Z",
    "likes": "826",
    "collections": "768",
    "comments": "17",
    "shares": "201",
    "expectedDurationSec": 3296
  },
  "subtitleStatus": "unchecked",
  "mediaCandidates": [
    {
      "kind": "video",
      "availability": "available",
      "expectedDurationSec": 3296
    }
  ]
}
