{
  "schemaVersion": "1.0",
  "id": "6a05780c0000000006020d23",
  "capturedAt": "2026-08-16T12:24:37.769Z",
  "strategy": "structured_state",
  "artifactRef": null,
  "error": null,
  "fields": {
    "title": "教程：如何做出好看的HTML slides（0代码）",
    "postCopy": "可以编辑、可以分享、可以嵌入图片、可以导出成pdf/ppt\n\t\n#vibecoding[话题]# #ppt模板[话题]# #ppt设计[话题]# #html[话题]#",
    "hashtags": [
      "vibecoding",
      "ppt模板",
      "ppt设计",
      "html"
    ],
    "topComments": [
      {
        "content": "欢迎加入粉丝群，入口在我的签名里",
        "likes": "2",
        "ipLocation": "美国",
        "author": "张咋啦",
        "replies": [
          {
            "content": "请问下Zara会再新建群吗，现在都满员了[哭惹R]",
            "author": "riri(BU版)"
          }
        ]
      },
      {
        "content": "HTML 取代 PPT，好看只是表层——真正要紧的是它是纯文本，AI 能直接读和改。PPT 是二进制黑箱，改一版还得手动开软件。AI 时代选工具，「agent 能不能调用」比好不好看关键得多🌱",
        "likes": "55",
        "ipLocation": "上海",
        "author": "慢慢地爬",
        "replies": [
          {
            "content": "@skshdb",
            "author": "嘎哩虫虫"
          }
        ]
      },
      {
        "content": "html可以分享传输到其他电脑上查看吗",
        "likes": "2",
        "ipLocation": "中国香港",
        "author": "umbrella",
        "replies": [
          {
            "content": "发布了才可以",
            "author": "我还能再坚持一个帕！"
          }
        ]
      },
      {
        "content": "是不是编辑修改次数有限制？到最后弹窗显示“looks like you've used all your credits\"\"",
        "likes": "5",
        "ipLocation": "上海",
        "author": "spinnerdolphin",
        "replies": [
          {
            "content": "how do I solve this limitation!",
            "author": "spinnerdolphin"
          }
        ]
      },
      {
        "content": "ppt下载的话乱码呀...[哭惹R]",
        "likes": "2",
        "ipLocation": "上海",
        "author": "蘑菇",
        "replies": [
          {
            "content": "same",
            "author": "哥哥点到为止"
          }
        ]
      },
      {
        "content": "@问一问 总结视频内容",
        "likes": "0",
        "ipLocation": "北京",
        "author": "夏日的晚风77",
        "replies": [
          {
            "content": "这条视频主要是在讲： 如何用 AI 工具零代码做出可编辑、可分享、支持嵌入图片和导出 PDF/PPT 的 HTML Slides。\n核心流程是先进入工具页面，选择模板后输入内容，由 AI 自动生成完整 slides\n视频里演示了从选模板、输入文案、AI 生成，到后续编辑文字、调整样式、插入图片的过程\n修改方式主要是直接点击编辑文字，或通过评论指令让 AI 批量调整，比如改字体、改颜色\n做完后可以直接分享链接，别人像打开网页一样查看；也可以下载成 PPT 或 PDF，再投屏展示\n视频后半段还补充了模板思路：日常收集海报、书封、平面设计等视觉素材，再让 AI 基于这些风格生成模板\n评论区讨论较多的点主要有：\n分享与传输：有人问能否传到其他电脑查看，评论里提到可以直接发文件，或发布后分享\n使用限制：有评论提到编辑次数可能有限，会出现“used all your credits”的提示\n导出问题：部分人反馈下载 PPT 格式时出现乱码，或只能下载当前页\n修改效果：有人表示用 comment 模式修改后，AI 返回的调整结果不明显\n适用场景：评论里认为文字排版基本可用，但复杂数据表格、海报式设计体验一般\n版权与来源：也有人关心素材是否侵权，以及和其它类似工具的差异\n整体看，视频重点是“用模板+AI指令快速做出视觉感较强的 HTML 演示页”，评论区则更关注实际使用中的限制、导出和修改效果。",
            "author": "问一问"
          }
        ]
      },
      {
        "content": "试了一下，生成方面还可以，如果有了提示词可以很快做出来一个看似还可以的。但是日常工作ppt如果有很多数据或者表格在的话，感觉也不是那么好用。而且重点是虽然可以下载ppt格式，但是下下来后是乱码。[笑哭R]",
        "likes": "2",
        "ipLocation": "上海",
        "author": "给我一个碗__",
        "replies": [
          {
            "content": "下载就要会员对不[笑哭R]",
            "author": "芋圆不骑车"
          }
        ]
      },
      {
        "content": "请问可以改字体大小吗",
        "likes": "0",
        "ipLocation": "辽宁",
        "author": "aaaaa",
        "replies": [
          {
            "content": "当然可以啊 直接跟它说 啥都能改啊",
            "author": "张咋啦"
          }
        ]
      },
      {
        "content": "无比感谢大数据把zara推给我，今天晚上做年中报告就用ta啦[赞R][赞R][赞R]",
        "likes": "1",
        "ipLocation": "北京",
        "author": "花姐呀",
        "replies": []
      },
      {
        "content": "谢谢老师分享[害羞R]，用来给Claude做备忘录效果超好！",
        "likes": "1",
        "ipLocation": "法国",
        "author": "圆圆",
        "replies": []
      }
    ],
    "sourceUrl": "https://www.xiaohongshu.com/explore/6a05780c0000000006020d23",
    "mediaType": "video",
    "publishedAt": "2026-05-14T07:21:48.000Z",
    "likes": "3013",
    "collections": "3582",
    "comments": "62",
    "shares": "835",
    "expectedDurationSec": 118
  },
  "subtitleStatus": "unchecked",
  "mediaCandidates": [
    {
      "kind": "video",
      "availability": "available",
      "expectedDurationSec": 118
    }
  ]
}
