{
  "schemaVersion": "1.0",
  "id": "6a3ff150000000002101a7a1",
  "capturedAt": "2026-08-16T11:09:09.155Z",
  "strategy": "structured_state",
  "artifactRef": null,
  "error": null,
  "fields": {
    "title": "为什么企业用了AI，效率还是没有提升？",
    "postCopy": "个人提效不代表组织提效，工厂从蒸汽机进化到电力的时候，效率的提升不只是因为有了电，而是因为工厂被重新设计了",
    "hashtags": [],
    "sourceUrl": "https://www.xiaohongshu.com/explore/6a3ff150000000002101a7a1",
    "mediaType": "video",
    "publishedAt": "2026-06-27T15:50:40.000Z",
    "likes": "740",
    "collections": "523",
    "comments": "34",
    "shares": "144",
    "expectedDurationSec": 95
  },
  "subtitleStatus": "unchecked",
  "mediaCandidates": [
    {
      "kind": "video",
      "availability": "available",
      "expectedDurationSec": 95
    }
  ]
}
