{
  "schemaVersion": "1.0",
  "id": "6a2e345e000000002003b49c",
  "capturedAt": "2026-08-16T11:09:16.831Z",
  "strategy": "structured_state",
  "artifactRef": null,
  "error": null,
  "fields": {
    "title": "50分钟完整版：我vibe coding的思路和方法",
    "postCopy": "近期在一个活动上的英文分享，介绍了我的各种Vibe coding项目以及幕后的制作过程和技巧\n\t\n#vibecoding大赏[话题]# #vibecoding[话题]# #全英[话题]#",
    "hashtags": [
      "vibecoding大赏",
      "vibecoding",
      "全英"
    ],
    "sourceUrl": "https://www.xiaohongshu.com/explore/6a2e345e000000002003b49c",
    "mediaType": "video",
    "publishedAt": "2026-06-14T04:55:59.000Z",
    "likes": "2707",
    "collections": "2879",
    "comments": "42",
    "shares": "558",
    "expectedDurationSec": 2980
  },
  "subtitleStatus": "unchecked",
  "mediaCandidates": [
    {
      "kind": "video",
      "availability": "available",
      "expectedDurationSec": 2980
    }
  ]
}
