{
  "schemaVersion": "1.0",
  "id": "69eac78d000000002202b86e",
  "capturedAt": "2026-08-16T11:30:44.411Z",
  "strategy": "structured_state",
  "artifactRef": null,
  "error": null,
  "fields": {
    "title": "Tab out的想法是怎么来的？我跟AI的聊天方式",
    "postCopy": "还原我跟Claude Code一起做Tab Out的过程，以及中间的一些lessons\n\t\n#vibecoding[话题]# #claudecode[话题]#",
    "hashtags": [
      "vibecoding",
      "claudecode"
    ],
    "topComments": [
      {
        "content": "非常同意你说的一点，就是其实做产品mvp的过程感觉是一个从复杂到简化的思考过程。要想的足够深，才能开始知道怎么减。",
        "likes": "77",
        "ipLocation": "美国",
        "author": "硅谷小白",
        "replies": [
          {
            "content": "同意",
            "author": "momo"
          }
        ]
      },
      {
        "content": "Hey Zara，感谢今天的线上 Demo Day。关于飞书，我想请问你现在管理文档和知识库之类的，主要用飞书了吗？",
        "likes": "4",
        "ipLocation": "丹麦",
        "author": "Jay的觉醒之旅",
        "replies": [
          {
            "content": "全是飞书",
            "author": "张咋啦"
          }
        ]
      },
      {
        "content": "这个story的html生成的也很好！里面的对话是AI帮忙找出来的，还是需要自己给他一些指定？",
        "likes": "10",
        "ipLocation": "浙江",
        "author": "摸摸",
        "replies": [
          {
            "content": "我也好奇，蹲一个回复",
            "author": "福星小照_Jal"
          }
        ]
      },
      {
        "content": "谢谢大佬！[萌萌哒R]在 Zara 大佬的 Tab Out 插件的基础上加了 To-Do List和网页标签栏的插件。欢迎大家使用和push我迭代~ github search :kaydong233-ux",
        "likes": "2",
        "ipLocation": "云南",
        "author": "南风女性教练",
        "replies": []
      },
      {
        "content": "Tabbit就不错，这些功能产品肯定会有公司去做的。",
        "likes": "2",
        "ipLocation": "北京",
        "author": "叶枫的Agent小店",
        "replies": []
      },
      {
        "content": "好棒的想法哇！",
        "likes": "0",
        "ipLocation": "广东",
        "author": "小羊到处爬",
        "replies": []
      },
      {
        "content": "很实用！",
        "likes": "0",
        "ipLocation": "上海",
        "author": "妙笔小夫",
        "replies": []
      },
      {
        "content": "先复杂化，再做减法～",
        "likes": "0",
        "ipLocation": "北京",
        "author": "张几何Gio",
        "replies": []
      },
      {
        "content": "去试试Arc，他内化了需要管理的任务",
        "likes": "2",
        "ipLocation": "广东",
        "author": "als",
        "replies": []
      },
      {
        "content": "好棒的提问逻辑和反思逻辑",
        "likes": "3",
        "ipLocation": "安徽",
        "author": "幸运玛卡巴卡，平安快乐",
        "replies": []
      }
    ],
    "sourceUrl": "https://www.xiaohongshu.com/explore/69eac78d000000002202b86e",
    "mediaType": "video",
    "publishedAt": "2026-04-24T01:29:49.000Z",
    "likes": "1400",
    "collections": "650",
    "comments": "42",
    "shares": "213",
    "expectedDurationSec": 247
  },
  "subtitleStatus": "unchecked",
  "mediaCandidates": [
    {
      "kind": "video",
      "availability": "available",
      "expectedDurationSec": 247
    }
  ]
}
