{
  "schemaVersion": "1.0",
  "id": "69cef878000000001e00c6bc",
  "capturedAt": "2026-08-16T11:10:31.675Z",
  "strategy": "structured_state",
  "artifactRef": null,
  "error": null,
  "fields": {
    "title": "用AI实现视频长剪短！自动提取高光片段",
    "postCopy": "如何用coding agent + 飞书CLI实现长视频的自动剪辑\n\t\n#飞书[话题]# #飞书开源cli[话题]# #飞书妙记[话题]# #vibecoding[话题]# #claudecode[话题]# #视频剪辑[话题]# #开源项目[话题]#",
    "hashtags": [
      "飞书",
      "飞书开源cli",
      "飞书妙记",
      "vibecoding",
      "claudecode",
      "视频剪辑",
      "开源项目"
    ],
    "sourceUrl": "https://www.xiaohongshu.com/explore/69cef878000000001e00c6bc",
    "mediaType": "video",
    "publishedAt": "2026-04-02T23:15:04.000Z",
    "likes": "1669",
    "collections": "1577",
    "comments": "51",
    "shares": "475",
    "expectedDurationSec": 214
  },
  "subtitleStatus": "unchecked",
  "mediaCandidates": [
    {
      "kind": "video",
      "availability": "available",
      "expectedDurationSec": 214
    }
  ]
}
