{
  "schemaVersion": "1.0",
  "id": "6a3f44b500000000210167f6",
  "capturedAt": "2026-08-16T11:09:11.110Z",
  "strategy": "structured_state",
  "artifactRef": null,
  "error": null,
  "fields": {
    "title": "AI时代，IC要更像管理者，管理者要更像IC",
    "postCopy": "关于AI native的组织和人才的一些思考",
    "hashtags": [],
    "sourceUrl": "https://www.xiaohongshu.com/explore/6a3f44b500000000210167f6",
    "mediaType": "video",
    "publishedAt": "2026-06-27T03:34:13.000Z",
    "likes": "611",
    "collections": "343",
    "comments": "27",
    "shares": "95",
    "expectedDurationSec": 176
  },
  "subtitleStatus": "unchecked",
  "mediaCandidates": [
    {
      "kind": "video",
      "availability": "available",
      "expectedDurationSec": 176
    }
  ]
}
